{
  "schema": "sc001.worker_result_manifest.v0.1",
  "project": "SC001",
  "experiment_id": "SC001-H1-003",
  "stage": "R1_MULTIPLICITY_DECISION_FREEZE",
  "date": "2026-10-04",
  "status": "H1_R1_MULTIPLICITY_FREEZE_READY_FOR_STRATEGY",
  "strategy_triggers": [
    "OTHER"
  ],
  "canonical_result": {
    "path": "docs/research/sc001-h1-r1-multiplicity-and-decision-freeze-v0.1.md",
    "sha256": "a3c9d33faefa4e99d42faf0903c2ff06701434f6cb29c02a51ab6b57a9c8c7f8"
  },
  "protocol": {
    "path": "docs/research/tasks/sc001-h1-003-r1-multiplicity-decision-freeze.json",
    "sha256": "05ce93e21162b1e35f5a8956d87fab20f86440390fc7f54613b30ac57b1eee1a"
  },
  "implementation": null,
  "execution": {
    "mode": "NONE",
    "bundle_id": null,
    "bundle_sha256": null,
    "job_id": null
  },
  "mechanism": {
    "fingerprint_ref": null,
    "disposition": "NOT_APPLICABLE_PRE_OUTCOME",
    "adaptive_discovery_generated": true
  },
  "evidence": {
    "class": "DEFINED_ONLY_ADAPTIVE_DISCOVERY_GENERATED",
    "promotional": false,
    "outcome_accessed": false,
    "window": null,
    "contamination_registry_ref": "docs/research/sc001-contamination-registry-v0.41.json"
  },
  "key_metrics": {
    "outcome_accessed": false,
    "protected_evidence_accessed": false,
    "market_rows_read": false,
    "network_accessed": false,
    "test_executor_job_launched": false,
    "runner_bundle_created": false,
    "runner_bundle_executed": false,
    "vps_data_read": false,
    "collector_changed": false,
    "frozen_r1_hypotheses": 4,
    "revalidated_main_sha": "c65021d200b417bda7cd24f64a1bca48c7c2bb89",
    "artifact_verification": "PASS: exact result fetched and SHA256 matched; task unchanged; binding main equals dispatch base; claim owned; no review comments. GitHub control-plane access only."
  },
  "decision": {
    "class": "PASS",
    "summary": "DESIGN_ONLY specification ready for Strategy review: unchanged four R1 formulas/orientations and 3/8/4/5-minute horizons; equal-asset/day rank association; one centered circular moving-block marginal bootstrap; Holm FWER alpha=0.05. Validity is asymptotic under stated stationary geometrically mixing calendar-score assumptions, not exact finite-sample control. Minimum 60 complete Discovery days; the benchmark minimum 120 total days alone is insufficient. Strict full-panel missingness and family-wide invalid/insufficient override are frozen. No outcomes, data sufficiency, implementation validity, profitability or promotion are claimed.",
    "failed_gate": null,
    "allowed_claims": [
      "Exact four-member R1 family, primary statistic, marginal test, Holm and terminal semantics specified before outcomes.",
      "Canonical formulas, roles and horizons agree with task and benchmark ledger.",
      "Design is ready for Strategy review only; statistical assumptions and 60-day Discovery minimum require explicit acceptance before outcome access.",
      "All nine safety receipts are false; network_accessed refers to research/source acquisition, not authorized GitHub control-plane operations."
    ],
    "forbidden_reuse": [
      "No finite-sample or arbitrary-serial-dependence FWER guarantee.",
      "No outcome execution or source acquisition authorization.",
      "No reorientation, parameter/horizon/symbol/hour/venue/statistic or resampling search.",
      "No partial-family success after missingness, invalid data or dependence-model failure.",
      "No state-only directional promotion; no rank association interpreted as fills, bps or PnL.",
      "No reuse of Discovery/Selection as independent Confirmation or protected P1 evidence as generic holdout.",
      "No shared-state mutation or PR/branch lifecycle action."
    ],
    "next_allowed_action": "Strategy Manager review of PR #432 and this manifest; explicitly assess inferential assumptions, strict missingness and breadth gates. Separate authorizations remain required for source qualification, joint H1/X1 freeze acceptance, implementation and every outcome run. Worker stops; no successor started."
  },
  "reusable_blocks": []
}
