{
  "schema": "sc001.worker_result_manifest.v0.1",
  "project": "SC001",
  "experiment_id": "B15-P2",
  "stage": "V018_ENGINEERING_GATE_OFFLINE_AND_PUBLIC_SMOKE",
  "date": "2026-09-29",
  "status": "ENGINEERING_GATE_PASS_USER_DECISION_REQUIRED",
  "strategy_triggers": [
    "EVIDENCE_MATURITY_CHANGE",
    "ROADMAP_GOVERNANCE_CHANGE"
  ],
  "canonical_result": {
    "path": "docs/research/sc001-b15p2-announcement-body-dual-schema-smoke-v0.1.8-result.json",
    "sha256": "21c80bbf0a921df9544c7c9d9ef04e4710f33985c5d5c51ed181ed19de4fc2b2"
  },
  "protocol": {
    "path": "docs/research/sc001-b15p2-announcement-body-semantic-audit-protocol-v0.1.md",
    "sha256": "4209779876e3796feff16a8310af93324cd1927862874524fb90ebf95d51d84f"
  },
  "implementation": {
    "path": "research/sc001/sc001_b15p2_announcement_body_semantic_audit_v0_1_8.py",
    "sha256": "c58d6c31f56c41d593ea5156d0e8ea407f9dfea1e515aa613a0d5113f5a0f9fa"
  },
  "execution": {
    "mode": "NETWORKED_VPS",
    "bundle_id": null,
    "bundle_sha256": null,
    "job_id": "job_20260929T125331Z_89a763dd"
  },
  "mechanism": {
    "fingerprint_ref": null,
    "disposition": "NOT_APPLICABLE_PRE_OUTCOME",
    "adaptive_discovery_generated": false
  },
  "evidence": {
    "class": "PRE_OUTCOME_ENGINEERING_VALIDATION",
    "promotional": false,
    "outcome_accessed": false,
    "window": null,
    "contamination_registry_ref": "docs/research/sc001-contamination-registry-v0.30.json"
  },
  "key_metrics": {
    "offline_selftest_pass": true,
    "public_smoke_pass": true,
    "smoke_event_count": 4,
    "schema_a_smoke_count": 2,
    "schema_b_smoke_count": 2,
    "engineering_iterations_consumed": 1,
    "engineering_iterations_remaining": 2
  },
  "decision": {
    "class": "HOLD",
    "summary": "B15-P2 v0.1.8 passed real offline dynamic self-test and a four-page same-endpoint public dual-schema smoke. Frozen 94-event source and semantic rules are unchanged; no economic outcomes were accessed. Full 94-event semantic rerun remains pending explicit user approval.",
    "failed_gate": null,
    "allowed_claims": [
      "v0.1.8 offline self-test passed through Test Executor",
      "Four-page dual-schema public smoke passed on the same official Bybit announcement endpoint class",
      "SCHEMA_A and SCHEMA_B routing remained consistent in the smoke",
      "No price/index/basis/returns/PnL outcome data was accessed"
    ],
    "forbidden_reuse": [
      "Do not infer strategy profitability from this engineering validation",
      "Do not treat the four-page smoke as the full 94-event semantic result",
      "Do not open price/index/basis/returns/PnL firewalls",
      "Do not alter the frozen 94-event set"
    ],
    "next_allowed_action": "Obtain explicit user approval before running the exact frozen v0.1.8 full 94-event semantic rerun."
  },
  "reusable_blocks": []
}
