{
  "schema": "sc001.worker_result_manifest.v0.1",
  "project": "SC001",
  "experiment_id": "SC001-H1-002",
  "stage": "SOURCE_PRIOR_USE_AUDIT",
  "date": "2026-10-03",
  "status": "H1_SOURCE_PRIOR_USE_AUDIT_DEFER_METADATA_ACCESS",
  "strategy_triggers": [
    "TERMINAL_REJECT_DEFER"
  ],
  "canonical_result": {
    "path": "docs/research/sc001-h1-binance-1m-source-prior-use-audit-v0.1.md",
    "sha256": "50ec6cdad8666fa67057765369a5557fca1abc9ba00ace17cd3d1149a854610b"
  },
  "protocol": {
    "path": "docs/research/tasks/sc001-h1-002-binance-source-prior-use-audit.json",
    "sha256": "155ddf25a1c28b9fb887a798b2a92b7a2792afa165b444ec36da29ec9e142c69"
  },
  "implementation": null,
  "execution": {
    "mode": "READ_ONLY",
    "bundle_id": null,
    "bundle_sha256": null,
    "job_id": null
  },
  "mechanism": {
    "fingerprint_ref": null,
    "disposition": "NOT_APPLICABLE_PRE_OUTCOME",
    "adaptive_discovery_generated": true
  },
  "evidence": {
    "class": "DESIGN_ONLY_SOURCE_PRIOR_USE_AUDIT_NONPROMOTIONAL",
    "promotional": false,
    "outcome_accessed": false,
    "window": null,
    "contamination_registry_ref": "docs/research/sc001-contamination-registry-v0.41.json"
  },
  "key_metrics": {
    "outcome_accessed": false,
    "protected_evidence_accessed": false,
    "market_rows_read": false,
    "network_accessed": false,
    "test_executor_job_launched": false,
    "runner_bundle_created": false,
    "runner_bundle_executed": false,
    "vps_read_text_used": false,
    "collector_changed": false,
    "common_coverage_proven": false,
    "local_reuse_verified": false,
    "revalidated_main_head": "300793b0f8065252fd0020ec96783a929b2bb72c"
  },
  "decision": {
    "class": "DEFER",
    "summary": "SC001-H1-002 / H1_HISTORICAL_INDICATORS: one permitted list_roots call exposed only unrelated b15_identity_inventory; no list_files or read_text followed. Missing approved H1 metadata prevents exact local/source identity, >=120-day common coverage, 6-12 instrument universe, prior-use mapping, DATASET_KEY/RESOURCE_ID/DERIVED_ID and exact evidence allocation from being proven. Q001/Q002 qualification is retained as historical engineering evidence only. Result and task SHA256 were verified from GitHub; after result persistence, main was identical to dispatch SHA 300793b0f8065252fd0020ec96783a929b2bb72c and associated comments remained empty. No new experiment or research execution occurred. This manifest is the final repository artifact; only terminal PR receipt follows.",
    "failed_gate": "APPROVED_H1_METADATA_SURFACE_NOT_EXPOSED; COVERAGE_AND_UNIVERSE_UNPROVEN",
    "allowed_claims": [
      "Current Reader metadata surface exposes only b15_identity_inventory; current H1 local presence remains unknown.",
      "Canonical Q001 reports one qualified BTCUSDT 1m day, not multi-symbol 120-day coverage.",
      "Settled single-day bar/quote-volume qualification is reused without rerunning a smoke.",
      "Unidentified legacy evidence remains CALIBRATION_ONLY_NONPROMOTIONAL; no block is certified untouched.",
      "Outcome, protected-evidence, market-row and source-network access remained false; GitHub and Reader metadata RPCs were used."
    ],
    "forbidden_reuse": [
      "No promotional reuse of Q001 engineering/calibration sample or terminal SC001 outcomes.",
      "No inference of acquired history from the protocol's target calendar.",
      "No exact dataset/derived identity, universe, evidence dates or local presence inferred from missing metadata.",
      "No alternate-root inspection, source acquisition, Runner/Test Executor workaround or protected P1 access.",
      "No parameter/horizon/symbol/hour/venue search, same-evidence rescue or new variants.",
      "No shared-state/data-registry writes; PROPOSED_SHARED_STATE_CHANGE: none.",
      "No merge, close, retarget, auto-merge or branch deletion."
    ],
    "next_allowed_action": "Stop for Strategy Manager review of PR #426. A separately authorized follow-up may provide an approved H1/SC001 metadata inventory and prior-use lineage; this receipt authorizes no new access or run. Leave PR open. Persistent webhook remains enabled; do not start another task."
  },
  "reusable_blocks": []
}
