{
  "schema": "sc001.worker_result_manifest.v0.1",
  "project": "SC001",
  "experiment_id": "SC001-P1-B15-W1-001",
  "stage": "B15-P1_STAGE_E_W1_SOURCE_ONLY_CENSUS",
  "date": "2026-10-11",
  "status": "B15P1_STAGE_E_W1_CENSUS_SOURCE_REVIEW",
  "strategy_triggers": [
    "TERMINAL_REJECT_DEFER"
  ],
  "canonical_result": {
    "path": "docs/research/sc001-p1-b15-w1-001-source-only-census-execution-result-v0.1.json",
    "sha256": "6b2e535b22500be5e425e0df804e3f002e99f772495774298ef47f437a52f58c"
  },
  "protocol": {
    "path": "docs/research/sc001-b15-p1-source-only-opportunity-rate-analysis-protocol-v0.1.md",
    "sha256": "a91e09d453515f85feb98d5a636eede0c66efa323d2ca7a9765855acf46edde2"
  },
  "implementation": {
    "path": "research/sc001/sc001_b15p1_stage_e_w1_real_data_census_bootstrap_v0_1.py",
    "sha256": "8473e8da24dadf0f272cf41421b7106d0e6ad50eae7af05b99017bb30ddb0f88"
  },
  "execution": {
    "mode": "OFFLINE_RUNNER",
    "bundle_id": "bundle_20260926T175529Z_93fa9025",
    "bundle_sha256": "1308ce4c140161618dc465672564bdc3f2409e62cf219dc6932bc7edf1891495",
    "job_id": "job_20261011T114243Z_57ec4c24"
  },
  "mechanism": {
    "fingerprint_ref": null,
    "disposition": "NOT_APPLICABLE_PRE_OUTCOME",
    "adaptive_discovery_generated": false
  },
  "evidence": {
    "class": "SOURCE_ONLY_W1_PRE_PRICE_QUALITY_CENSUS_NONPROMOTIONAL",
    "promotional": false,
    "outcome_accessed": false,
    "window": "2026-09-27T00:00:00Z/2026-10-04T00:00:00Z",
    "contamination_registry_ref": "docs/research/sc001-contamination-registry-v0.33.json"
  },
  "key_metrics": {
    "runner_submission_count": 1,
    "runner_retry_count": 0,
    "allowed_input_count": 17,
    "materialized_input_count": 17,
    "package_integrity_ok": true,
    "quality_gate_evaluated": false,
    "price_accessed": false,
    "pnl_calculated": false,
    "network_calls": 0,
    "collector_mutations": 0,
    "collector_restarts": 0
  },
  "decision": {
    "class": "DEFER",
    "summary": "The exact one-shot source-only W1 census ran once and failed closed before poll quality analysis because the materialized collector_state snapshot did not report B15P1_NONPRICE_COLLECTION_RUNNING. Package integrity and all 17 declared input materializations passed. No retry, repair, price/PnL access, network action, credential use, or collector mutation occurred.",
    "failed_gate": "COLLECTOR_SNAPSHOT_STATUS_MUST_EQUAL_B15P1_NONPRICE_COLLECTION_RUNNING",
    "allowed_claims": [
      "The exact sealed bundle was submitted once under the recorded T3 authorization.",
      "All 17 declared source-only inputs materialized and the sealed package integrity passed.",
      "The run stopped before W1 coverage, both-venue-valid fraction, and hash-chain continuity could be evaluated.",
      "No price, PnL, opportunity-rate inference, network call, credential use, collector mutation, or collector restart occurred."
    ],
    "forbidden_reuse": [
      "Do not claim W1 source-quality PASS.",
      "Do not infer event frequency or opportunity rate.",
      "Do not retry this bundle under the current task.",
      "Do not change collector state or restart policy from this result.",
      "Do not proceed to the second-stage W1 analyzer or any price/outcome stage."
    ],
    "next_allowed_action": "Strategy Manager review of the collector-snapshot terminal state and exact diagnosis boundary; any future execution requires a new exact authorization/task."
  },
  "reusable_blocks": []
}
